<?xml version="1.0" encoding="utf-8"?>
<!DOCTYPE EwdTree SYSTEM "../../../../../dtd/ewdtree.dtd">
<EwdTree ver="2.1.2.9" pubno="EM25T2E" xml:lang="en">
  <note ewd="WIRE030" code="O6" type="conn">
    <name>Door Control Relay Assembly</name>
  </note>
  <note ewd="WIRE030" code="O15" type="conn">
    <name>Door Control Relay Assembly</name>
  </note>
  <note ewd="WIRE030" code="O14" type="conn">
    <name>Door Control Switch</name>
  </note>
  <note ewd="WIRE030" code="O3" type="conn">
    <name>Front Door Lock Actuator Assembly RH</name>
  </note>
  <note ewd="WIRE030" code="O4" type="conn">
    <name>Front Door Lock Actuator Assembly RH</name>
  </note>
  <note ewd="WIRE030" code="O5" type="conn">
    <name>Front Door Lock Actuator Assembly RH</name>
  </note>
  <note ewd="WIRE030" code="O7" type="conn">
    <name>Front Door Lock Actuator Assembly RH</name>
  </note>
  <note ewd="WIRE030" code="O2" type="conn">
    <name>Front Power Window Regulator Motor Assembly RH</name>
  </note>
  <note ewd="WIRE030" code="O10" type="conn">
    <name>Front Power Window Regulator Switch Assembly RH</name>
  </note>
  <note ewd="WIRE030" code="O11" type="conn">
    <name>Front Power Window Regulator Switch Assembly RH</name>
  </note>
  <note ewd="WIRE030" code="O8" type="conn">
    <name>Power Window Regulator Master Switch Assembly</name>
  </note>
  <note ewd="WIRE030" code="O9" type="conn">
    <name>Power Window Regulator Master Switch Assembly</name>
  </note>
  <note ewd="WIRE030" code="Oj1" type="w2w">
    <name>Front Door Wire RH and Switch Wire RH</name>
  </note>
  <note ewd="WIRE030" code="Oj2" type="w2w">
    <name>Front Door Wire RH and Switch Wire RH</name>
  </note>
</EwdTree>