<?xml version="1.0" encoding="utf-8"?>
<!DOCTYPE EwdTree SYSTEM "../../../dtd/ewdtree.dtd">
<EwdTree ver="2.1.2.9" pubno="EM25T2E" xml:lang="en">
  <book id="L-EG">
    <name>Engine Compartment</name>
    <note id="WR001" icon="P" file="T">
      <name>Position of Parts (LHD 1GR-FE)</name>
    </note>
    <note id="WR004" icon="P" file="T">
      <name>Position of Parts (LHD 1HZ)</name>
    </note>
    <note id="WR007" icon="P" file="T">
      <name>Position of Parts (LHD 1VD-FTV)</name>
    </note>
    <note id="WR021" icon="P" file="T">
      <name>Position of Parts (RHD 1GR-FE)</name>
    </note>
    <note id="WR024" icon="P" file="T">
      <name>Position of Parts (RHD 1HZ)</name>
    </note>
    <note id="WR027" icon="P" file="T">
      <name>Position of Parts (RHD 1VD-FTV)</name>
    </note>
    <note id="WR043" icon="P" file="T">
      <name>Wire and Wire (LHD 1GR-FE)</name>
    </note>
    <note id="WR044" icon="P" file="T">
      <name>Ground Points (LHD 1GR-FE)</name>
    </note>
    <note id="WR045" icon="P" file="T">
      <name>Wire and Wire (LHD 1HZ)</name>
    </note>
    <note id="WR046" icon="P" file="T">
      <name>Ground Points (LHD 1HZ)</name>
    </note>
    <note id="WR047" icon="P" file="T">
      <name>Wire and Wire (LHD 1VD-FTV)</name>
    </note>
    <note id="WR048" icon="P" file="T">
      <name>Ground Points (LHD 1VD-FTV)</name>
    </note>
    <note id="WR059" icon="P" file="T">
      <name>Wire and Wire (RHD 1GR-FE)</name>
    </note>
    <note id="WR060" icon="P" file="T">
      <name>Ground Points (RHD 1GR-FE)</name>
    </note>
    <note id="WR061" icon="P" file="T">
      <name>Wire and Wire (RHD 1HZ)</name>
    </note>
    <note id="WR062" icon="P" file="T">
      <name>Ground Points (RHD 1HZ)</name>
    </note>
    <note id="WR063" icon="P" file="T">
      <name>Wire and Wire (RHD 1VD-FTV)</name>
    </note>
    <note id="WR064" icon="P" file="T">
      <name>Ground Points (RHD 1VD-FTV)</name>
    </note>
    <book id="RELAY_RL001" file="T">
      <name>Relay Location</name>
    </book>
  </book>
  <book id="L-INPA">
    <name>Instrument Panel</name>
    <note id="WR011" icon="P" file="T">
      <name>Position of Parts (LHD)</name>
    </note>
    <note id="WR031" icon="P" file="T">
      <name>Position of Parts (RHD)</name>
    </note>
    <note id="WR049" icon="P" file="T">
      <name>Wire and Wire (LHD)</name>
    </note>
    <note id="WR050" icon="P" file="T">
      <name>Ground Points (LHD)</name>
    </note>
    <note id="WR065" icon="P" file="T">
      <name>Wire and Wire (RHD)</name>
    </note>
    <note id="WR066" icon="P" file="T">
      <name>Ground Points (RHD)</name>
    </note>
    <book id="RELAY_RL002" file="T">
      <name>Relay Location(LHD)</name>
    </book>
    <book id="RELAY_RL003" file="T">
      <name>Relay Location(RHD)</name>
    </book>
  </book>
  <book id="L-BODY">
    <name>Body</name>
    <note id="WR013" icon="P" file="T">
      <name>Position of Parts (LHD 4-Door Except Pick-Up)</name>
    </note>
    <note id="WR015" icon="P" file="T">
      <name>Position of Parts (LHD 2-Door Except Pick-Up)</name>
    </note>
    <note id="WR017" icon="P" file="T">
      <name>Position of Parts (LHD 4-Door Pick-Up)</name>
    </note>
    <note id="WR019" icon="P" file="T">
      <name>Position of Parts (LHD 2-Door Pick-Up)</name>
    </note>
    <note id="WR035" icon="P" file="T">
      <name>Position of Parts (RHD 4-Door Except Pick-Up)</name>
    </note>
    <note id="WR037" icon="P" file="T">
      <name>Position of Parts (RHD 2-Door Except Pick-Up)</name>
    </note>
    <note id="WR039" icon="P" file="T">
      <name>Position of Parts (RHD 4-Door Pick-Up)</name>
    </note>
    <note id="WR041" icon="P" file="T">
      <name>Position of Parts (RHD 2-Door Pick-Up)</name>
    </note>
    <note id="WR051" icon="P" file="T">
      <name>Wire and Wire (LHD 4-Door Except Pick-Up)</name>
    </note>
    <note id="WR052" icon="P" file="T">
      <name>Ground Points (LHD 4-Door Except Pick-Up)</name>
    </note>
    <note id="WR053" icon="P" file="T">
      <name>Wire and Wire (LHD 2-Door Except Pick-Up)</name>
    </note>
    <note id="WR054" icon="P" file="T">
      <name>Ground Points (LHD 2-Door Except Pick-Up)</name>
    </note>
    <note id="WR055" icon="P" file="T">
      <name>Wire and Wire (LHD 4-Door Pick-Up)</name>
    </note>
    <note id="WR056" icon="P" file="T">
      <name>Ground Points (LHD 4-Door Pick-Up)</name>
    </note>
    <note id="WR057" icon="P" file="T">
      <name>Wire and Wire (LHD 2-Door Pick-Up)</name>
    </note>
    <note id="WR058" icon="P" file="T">
      <name>Ground Points (LHD 2-Door Pick-Up)</name>
    </note>
    <note id="WR067" icon="P" file="T">
      <name>Wire and Wire (RHD 4-Door Except Pick-Up)</name>
    </note>
    <note id="WR068" icon="P" file="T">
      <name>Ground Points (RHD 4-Door Except Pick-Up)</name>
    </note>
    <note id="WR069" icon="P" file="T">
      <name>Wire and Wire (RHD 2-Door Except Pick-Up)</name>
    </note>
    <note id="WR070" icon="P" file="T">
      <name>Ground Points (RHD 2-Door Except Pick-Up)</name>
    </note>
    <note id="WR071" icon="P" file="T">
      <name>Wire and Wire (RHD 4-Door Pick-Up)</name>
    </note>
    <note id="WR072" icon="P" file="T">
      <name>Ground Points (RHD 4-Door Pick-Up)</name>
    </note>
    <note id="WR073" icon="P" file="T">
      <name>Wire and Wire (RHD 2-Door Pick-Up)</name>
    </note>
    <note id="WR074" icon="P" file="T">
      <name>Ground Points (RHD 2-Door Pick-Up)</name>
    </note>
    <book id="RELAY_RL004" file="T">
      <name>Relay Location(4-Door Except Pick-Up)</name>
    </book>
    <book id="RELAY_RL005" file="T">
      <name>Relay Location(2-Door Except Pick-Up)</name>
    </book>
    <book id="RELAY_RL006" file="T">
      <name>Relay Location(4-Door Pick-Up)</name>
    </book>
    <book id="RELAY_RL007" file="T">
      <name>Relay Location(2-Door Pick-Up)</name>
    </book>
  </book>
  <book id="L-ANTE">
    <name>Antenna</name>
    <note id="WR075" file="T">
      <name>Antenna (4-Door Except Pick-Up)</name>
    </note>
    <note id="WR076" file="T">
      <name>Antenna (2-Door Except Pick-Up)</name>
    </note>
    <note id="WR077" file="T">
      <name>Antenna (4-Door Pick-Up)</name>
    </note>
    <note id="WR078" file="T">
      <name>Antenna (2-Door Pick-Up)</name>
    </note>
  </book>
</EwdTree>