<?xml version="1.0" encoding="utf-8"?>
<!DOCTYPE EwdTree SYSTEM "../../../dtd/ewdtree.dtd">
<EwdTree ver="2.1.2.9" pubno="EM25T2E" xml:lang="en">
  <text ewd="WR017" code="P7" type="conn">
    <name>Door Control Relay Assembly</name>
  </text>
  <text ewd="WR017" code="S4" type="conn">
    <name>Front Door Courtesy Light Switch Assembly RH</name>
  </text>
  <text ewd="WR017" code="P5" type="conn">
    <name>Front Door Lock Actuator Assembly LH</name>
  </text>
  <text ewd="WR017" code="P8" type="conn">
    <name>Front Door Lock Actuator Assembly LH</name>
  </text>
  <text ewd="WR017" code="O3" type="conn">
    <name>Front Door Lock Actuator Assembly RH</name>
  </text>
  <text ewd="WR017" code="P2" type="conn">
    <name>Front Power Window Regulator Motor Assembly LH</name>
  </text>
  <text ewd="WR017" code="O2" type="conn">
    <name>Front Power Window Regulator Motor Assembly RH</name>
  </text>
  <text ewd="WR017" code="O10" type="conn">
    <name>Front Power Window Regulator Switch Assembly RH</name>
  </text>
  <text ewd="WR017" code="S2" type="conn">
    <name>Front Seat Inner Belt Assembly LH</name>
  </text>
  <text ewd="WR017" code="S3" type="conn">
    <name>Parking Brake Switch Assembly</name>
  </text>
  <text ewd="WR017" code="S15" type="conn">
    <name>Parking Brake Switch Assembly</name>
  </text>
  <text ewd="WR017" code="P9" type="conn">
    <name>Power Window Regulator Master Switch Assembly</name>
  </text>
  <text ewd="WR017" code="S13" type="conn">
    <name>Rear Door Courtesy Light Switch Assembly RH</name>
  </text>
  <text ewd="WR017" code="S16" type="conn">
    <name>Rear Door Courtesy Light Switch Assembly RH</name>
  </text>
  <text ewd="WR017" code="Q2" type="conn">
    <name>Rear Door Lock Actuator Assembly LH</name>
  </text>
  <text ewd="WR017" code="R2" type="conn">
    <name>Rear Door Lock Actuator Assembly RH</name>
  </text>
  <text ewd="WR017" code="S5" type="conn">
    <name>Rear Heater Blower Resistor</name>
  </text>
  <text ewd="WR017" code="S10" type="conn">
    <name>Rear Heater Blower Switch</name>
  </text>
  <text ewd="WR017" code="Q3" type="conn">
    <name>Rear Power Window Regulator Motor Assembly LH</name>
  </text>
  <text ewd="WR017" code="R3" type="conn">
    <name>Rear Power Window Regulator Motor Assembly RH</name>
  </text>
  <text ewd="WR017" code="Q1" type="conn">
    <name>Rear Power Window Regulator Switch Assembly LH</name>
  </text>
  <text ewd="WR017" code="R1" type="conn">
    <name>Rear Power Window Regulator Switch Assembly RH</name>
  </text>
  <text ewd="WR018" code="T11" type="conn">
    <name>Back Buzzer Assembly</name>
  </text>
  <text ewd="WR018" code="V2" type="conn">
    <name>Differential Lock Shift Actuator</name>
  </text>
  <text ewd="WR018" code="U1" type="conn">
    <name>Front Door Courtesy Light Switch Assembly LH</name>
  </text>
  <text ewd="WR018" code="T8" type="conn">
    <name>Fuel Pump (Sub)</name>
  </text>
  <text ewd="WR018" code="T9" type="conn">
    <name>Fuel Sender Gage Assembly (Rear)</name>
  </text>
  <text ewd="WR018" code="T19" type="conn">
    <name>Fuel Sender Gage Assembly (Rear)</name>
  </text>
  <text ewd="WR018" code="T15" type="conn">
    <name>License Plate Light Assembly LH</name>
  </text>
  <text ewd="WR018" code="T16" type="conn">
    <name>License Plate Light Assembly LH</name>
  </text>
  <text ewd="WR018" code="T12" type="conn">
    <name>License Plate Light Assembly RH</name>
  </text>
  <text ewd="WR018" code="T13" type="conn">
    <name>License Plate Light Assembly RH</name>
  </text>
  <text ewd="WR018" code="Y5" type="conn">
    <name>No. 1 Room Light Assembly</name>
  </text>
  <text ewd="WR018" code="i1" type="conn">
    <name>Outer Rear View Mirror Assembly LH</name>
  </text>
  <text ewd="WR018" code="j1" type="conn">
    <name>Outer Rear View Mirror Assembly RH</name>
  </text>
  <text ewd="WR018" code="T17" type="conn">
    <name>Rear Combination Light Assembly LH</name>
  </text>
  <text ewd="WR018" code="T14" type="conn">
    <name>Rear Combination Light Assembly RH</name>
  </text>
  <text ewd="WR018" code="V1" type="conn">
    <name>Rear Differential Lock Position Switch</name>
  </text>
  <text ewd="WR018" code="U2" type="conn">
    <name>Rear Door Courtesy Light Switch Assembly LH</name>
  </text>
  <text ewd="WR018" code="T18" type="conn">
    <name>Rear Fog Light Socket &amp; Wire</name>
  </text>
  <text ewd="WR018" code="V3" type="conn">
    <name>Rear Speed Sensor (Skid Control Sensor Wire)</name>
  </text>
  <text ewd="WR018" code="Y7" type="conn">
    <name>Tire Pressure Warning ECU and Receiver</name>
  </text>
  <text ewd="WR018" code="T10" type="conn">
    <name>Trailer Socket</name>
  </text>
</EwdTree>