<?xml version="1.0" encoding="utf-8"?>
<!DOCTYPE EwdTree SYSTEM "../../../dtd/ewdtree.dtd">
<EwdTree ver="2.1.2.9" pubno="EM25T2E" xml:lang="en">
  <text ewd="WR060" code="AA" type="gp">
    <name>Ground Point</name>
  </text>
  <text ewd="WR060" code="AC" type="gp">
    <name>Ground Point</name>
  </text>
  <text ewd="WR060" code="AD" type="gp">
    <name>Ground Point</name>
  </text>
  <text ewd="WR060" code="CA" type="gp">
    <name>Ground Point</name>
  </text>
  <text ewd="WR060" code="CB" type="gp">
    <name>Ground Point</name>
  </text>
  <text ewd="WR060" code="DA" type="gp">
    <name>Ground Point</name>
  </text>
  <text ewd="WR060" code="HA" type="gp">
    <name>Ground Point</name>
  </text>
  <text ewd="WR060" code="HB" type="gp">
    <name>Ground Point</name>
  </text>
  <text ewd="WR060" code="IE" type="gp">
    <name>Ground Point</name>
  </text>
  <text ewd="WR060" code="tA" type="gp">
    <name>Ground Point</name>
  </text>
</EwdTree>