<?xml version="1.0" encoding="utf-8"?>
<!DOCTYPE EwdTree SYSTEM "../../../dtd/ewdtree.dtd">
<EwdTree ver="2.1.2.9" pubno="EM25T2E" xml:lang="en">
  <note ewd="WIRE002" code="B2" type="conn">
    <name>Front Differential Lock Position Switch</name>
  </note>
  <note ewd="WIRE002" code="B3" type="conn">
    <name>Front Speed Sensor RH (Skid Control Sensor Wire RH)</name>
  </note>
  <note ewd="WIRE002" code="B4" type="conn">
    <name>Front Speed Sensor RH (Skid Control Sensor Wire RH)</name>
  </note>
  <note ewd="WIRE002" code="B1" type="conn">
    <name>No. 2 Differential Lock Shift Actuator</name>
  </note>
  <note ewd="WIRE002" code="B5" type="conn">
    <name>No. 2 Differential Lock Shift Actuator</name>
  </note>
  <note ewd="WIRE002" code="BI2" type="w2w">
    <name>No. 2 Engine Room Wire and Cowl Wire</name>
  </note>
</EwdTree>