<?xml version="1.0" encoding="utf-8"?>
<!DOCTYPE EwdTree SYSTEM "../../../dtd/ewdtree.dtd">
<EwdTree ver="2.1.2.9" pubno="EM25T2E" xml:lang="en">
  <text ewd="SYS059" code="O2,P2" type="conn" figID="1,2">
    <name>Front Power Window Regulator Motor Assembly RH , Front Power Window Regulator Motor Assembly LH</name>
  </text>
  <text ewd="SYS059" code="O10,O11,P11,P12" type="conn" figID="10">
    <name>Front Power Window Regulator Switch Assembly RH , Front Power Window Regulator Switch Assembly LH</name>
  </text>
  <text ewd="SYS059" code="I96" type="conn" figID="9">
    <name>No. 20 Junction Connector</name>
  </text>
  <text ewd="SYS059" code="I93" type="conn" figID="6">
    <name>No. 5 Junction Connector</name>
  </text>
  <text ewd="SYS059" code="O8,O9,P9,P10" type="conn" figID="8">
    <name>Power Window Regulator Master Switch Assembly</name>
  </text>
  <text ewd="SYS059" code="Q3" type="conn" figID="4">
    <name>Rear Power Window Regulator Motor Assembly LH</name>
  </text>
  <text ewd="SYS059" code="R3" type="conn" figID="3">
    <name>Rear Power Window Regulator Motor Assembly RH</name>
  </text>
  <text ewd="SYS059" code="Q1" type="conn" figID="11">
    <name>Rear Power Window Regulator Switch Assembly LH</name>
  </text>
  <text ewd="SYS059" code="R1" type="conn" figID="7">
    <name>Rear Power Window Regulator Switch Assembly RH</name>
  </text>
  <text ewd="SYS059" code="FUSE32" type="fuse" figID="61">
    <name>30A POWER</name>
  </text>
  <text ewd="SYS059" code="IA" type="gp" figID="50">
    <name />
  </text>
  <text ewd="SYS059" code="IC" type="gp" figID="51">
    <name />
  </text>
  <text ewd="SYS059" code="FUSE32" type="rb" figID="5">
    <name>30A POWER</name>
  </text>
  <text ewd="SYS059" code="SP61" type="sp" figID="55,56,57">
    <name />
  </text>
  <text ewd="SYS059" code="SP66" type="sp" figID="59">
    <name />
  </text>
  <text ewd="SYS059" code="SP88" type="sp" figID="60">
    <name />
  </text>
  <text ewd="SYS059" code="SP93" type="sp" figID="58">
    <name />
  </text>
  <text ewd="SYS059" code="SP142" type="sp" figID="54">
    <name />
  </text>
  <text ewd="SYS059" code="SP143" type="sp" figID="53">
    <name />
  </text>
  <text ewd="SYS059" code="SP144" type="sp" figID="52">
    <name />
  </text>
  <text ewd="SYS059" code="IS2" type="w2w" figID="33,37">
    <name>Cowl Wire and Floor Wire</name>
  </text>
  <text ewd="SYS059" code="IS3" type="w2w" figID="16">
    <name>Cowl Wire and Floor Wire</name>
  </text>
  <text ewd="SYS059" code="PI2" type="w2w" figID="13,40,44">
    <name>Front Door Wire LH and Cowl Wire</name>
  </text>
  <text ewd="SYS059" code="PI3" type="w2w" figID="24,29,31,35,39,43,47,49">
    <name>Front Door Wire LH and Cowl Wire</name>
  </text>
  <text ewd="SYS059" code="OI4" type="w2w" figID="14,41,45">
    <name>Front Door Wire RH and Cowl Wire</name>
  </text>
  <text ewd="SYS059" code="OI5" type="w2w" figID="23,28,30,34,38,42,46,48">
    <name>Front Door Wire RH and Cowl Wire</name>
  </text>
  <text ewd="SYS059" code="RS1" type="w2w" figID="15,32,36">
    <name>No. 1 Rear Door Wire and Floor Wire</name>
  </text>
  <text ewd="SYS059" code="QU1" type="w2w" figID="17,20,25">
    <name>No. 2 Rear Door Wire and No. 3 Floor Wire</name>
  </text>
  <text ewd="SYS059" code="UI4" type="w2w" figID="19,22,27">
    <name>No. 3 Floor Wire and Cowl Wire</name>
  </text>
  <text ewd="SYS059" code="UI5" type="w2w" figID="18,21,26">
    <name>No. 3 Floor Wire and Cowl Wire</name>
  </text>
</EwdTree>