<?xml version="1.0" encoding="utf-8"?>
<!DOCTYPE EwdTree SYSTEM "../../../dtd/ewdtree.dtd">
<EwdTree ver="2.1.2.9" pubno="EM25T2E" xml:lang="en">
  <note ewd="WIRE001" code="A6" type="conn">
    <name>A/C Pressure Switch (Cooler Refrigerant Liquid Pipe B)</name>
  </note>
  <note ewd="WIRE001" code="A10" type="conn">
    <name>Antenna with Holder Assembly</name>
  </note>
  <note ewd="WIRE001" code="A35" type="conn">
    <name>Battery (Main)</name>
  </note>
  <note ewd="WIRE001" code="A36" type="conn">
    <name>Battery (Main)</name>
  </note>
  <note ewd="WIRE001" code="A37" type="conn">
    <name>Battery (Sub)</name>
  </note>
  <note ewd="WIRE001" code="A20" type="conn">
    <name>Brake Actuator Assembly</name>
  </note>
  <note ewd="WIRE001" code="A42" type="conn">
    <name>Brake Actuator Assembly</name>
  </note>
  <note ewd="WIRE001" code="A15" type="conn">
    <name>Brake Fluid Level Warning Switch (Brake Master Cylinder Reservoir Sub-Assembly)</name>
  </note>
  <note ewd="WIRE001" code="A25" type="conn">
    <name>Brake Vacuum Check Valve Assembly</name>
  </note>
  <note ewd="WIRE001" code="A26" type="conn">
    <name>Brake Vacuum Check Valve Assembly</name>
  </note>
  <note ewd="WIRE001" code="A27" type="conn">
    <name>Brake Vacuum Check Valve Assembly</name>
  </note>
  <note ewd="WIRE001" code="A28" type="conn">
    <name>Brake Vacuum Check Valve Assembly</name>
  </note>
  <note ewd="WIRE001" code="A29" type="conn">
    <name>ECM</name>
  </note>
  <note ewd="WIRE001" code="A13" type="conn">
    <name>Front Airbag Sensor LH</name>
  </note>
  <note ewd="WIRE001" code="A21" type="conn">
    <name>Front Speed Sensor LH (Skid Control Sensor Wire LH)</name>
  </note>
  <note ewd="WIRE001" code="A8" type="conn">
    <name>Fuel Filter Vacuum Sensor</name>
  </note>
  <note ewd="WIRE001" code="A16" type="conn">
    <name>Fuel Heater</name>
  </note>
  <note ewd="WIRE001" code="A17" type="conn">
    <name>Fuel Pump Resistor Assembly</name>
  </note>
  <note ewd="WIRE001" code="A40" type="conn">
    <name>Fuel Pump Resistor Assembly</name>
  </note>
  <note ewd="WIRE001" code="A9" type="conn">
    <name>Fuel Sediment Switch</name>
  </note>
  <note ewd="WIRE001" code="A1" type="conn">
    <name>Headlight Assembly LH</name>
  </note>
  <note ewd="WIRE001" code="A3" type="conn">
    <name>Headlight Assembly LH</name>
  </note>
  <note ewd="WIRE001" code="A7" type="conn">
    <name>Headlight Assembly LH</name>
  </note>
  <note ewd="WIRE001" code="A14" type="conn">
    <name>Headlight Assembly LH</name>
  </note>
  <note ewd="WIRE001" code="A38" type="conn">
    <name>Headlight Assembly LH</name>
  </note>
  <note ewd="WIRE001" code="A5" type="conn">
    <name>High Pitched Horn Assembly</name>
  </note>
  <note ewd="WIRE001" code="A4" type="conn">
    <name>Low Pitched Horn Assembly</name>
  </note>
  <note ewd="WIRE001" code="A22" type="conn">
    <name>No. 1 Junction Connector</name>
  </note>
  <note ewd="WIRE001" code="A18" type="conn">
    <name>No. 1 Vacuum Switching Valve (A/C Idle-Up)</name>
  </note>
  <note ewd="WIRE001" code="A41" type="conn">
    <name>No. 1 Vacuum Switching Valve (A/C Idle-Up)</name>
  </note>
  <note ewd="WIRE001" code="A23" type="conn">
    <name>No. 2 Junction Connector</name>
  </note>
  <note ewd="WIRE001" code="A24" type="conn">
    <name>No. 3 CAN Junction Connector</name>
  </note>
  <note ewd="WIRE001" code="A43" type="conn">
    <name>No. 34 Junction Connector</name>
  </note>
  <note ewd="WIRE001" code="A11" type="conn">
    <name>Side Turn Signal Light Assembly LH</name>
  </note>
  <note ewd="WIRE001" code="A2" type="conn">
    <name>Windshield Washer Motor and Pump Assembly</name>
  </note>
  <note ewd="WIRE001" code="A12" type="conn">
    <name>Windshield Wiper Motor Assembly</name>
  </note>
  <note ewd="WIRE001" code="A39" type="conn">
    <name>Windshield Wiper Motor Assembly</name>
  </note>
  <note ewd="WIRE001" code="4A" type="jbc">
    <name>Engine Room Main Wire and Fuse Block Assembly</name>
  </note>
  <note ewd="WIRE001" code="4B" type="jbc">
    <name>Engine Room Main Wire and Fuse Block Assembly</name>
  </note>
  <note ewd="WIRE001" code="3B" type="jbc">
    <name>Engine Room Main Wire and Fusible Link Block Assembly</name>
  </note>
  <note ewd="WIRE001" code="3C" type="jbc">
    <name>Engine Room Main Wire and Fusible Link Block Assembly</name>
  </note>
  <note ewd="WIRE001" code="3D" type="jbc">
    <name>Engine Room Main Wire and Fusible Link Block Assembly</name>
  </note>
  <note ewd="WIRE001" code="3E" type="jbc">
    <name>Engine Room Main Wire and Fusible Link Block Assembly</name>
  </note>
  <note ewd="WIRE001" code="3F" type="jbc">
    <name>Engine Room Main Wire and Fusible Link Block Assembly</name>
  </note>
  <note ewd="WIRE001" code="3G" type="jbc">
    <name>Engine Room Main Wire and Fusible Link Block Assembly</name>
  </note>
  <note ewd="WIRE001" code="3H" type="jbc">
    <name>Engine Room Main Wire and Fusible Link Block Assembly</name>
  </note>
  <note ewd="WIRE001" code="3I" type="jbc">
    <name>Engine Room Main Wire and Fusible Link Block Assembly</name>
  </note>
  <note ewd="WIRE001" code="3A" type="jbc">
    <name>Engine Room Main Wire and Fusible Link Block Assembly [1HZ]</name>
  </note>
  <note ewd="WIRE001" code="AC1" type="w2w">
    <name>Engine Room Main Wire and Engine Wire</name>
  </note>
  <note ewd="WIRE001" code="AC2" type="w2w">
    <name>Engine Room Main Wire and Engine Wire</name>
  </note>
  <note ewd="WIRE001" code="AC3" type="w2w">
    <name>Engine Room Main Wire and Engine Wire</name>
  </note>
  <note ewd="WIRE001" code="AC5" type="w2w">
    <name>Engine Room Main Wire and Engine Wire</name>
  </note>
  <note ewd="WIRE001" code="AC7" type="w2w">
    <name>Engine Room Main Wire and Engine Wire</name>
  </note>
  <note ewd="WIRE001" code="AC8" type="w2w">
    <name>Engine Room Main Wire and Engine Wire</name>
  </note>
  <note ewd="WIRE001" code="AC9" type="w2w">
    <name>Engine Room Main Wire and Engine Wire</name>
  </note>
  <note ewd="WIRE001" code="AC10" type="w2w">
    <name>Engine Room Main Wire and Engine Wire</name>
  </note>
  <note ewd="WIRE001" code="AC11" type="w2w">
    <name>Engine Room Main Wire and Engine Wire</name>
  </note>
</EwdTree>