<?xml version="1.0" encoding="utf-8"?>
<!DOCTYPE EwdTree SYSTEM "../../../../../dtd/ewdtree.dtd">
<EwdTree ver="2.1.2.9" pubno="EM25T2E" xml:lang="en">
  <book id="S-EG">
    <name>Engine / Hybrid System</name>
    <note id="SYS018" icon="P" file="T">
      <name>Emission Control (Before Aug. 2016 Production)</name>
    </note>
    <note id="SYS026" icon="P" file="T">
      <name>Fuel Heater (Before Aug. 2016 Production)</name>
    </note>
    <note id="SYS030" icon="P" file="T">
      <name>Fuel Tank Changeover (Diesel) (Before Aug. 2016 Production)</name>
    </note>
    <note id="SYS032" icon="P" file="T">
      <name>Glow Plug (w/o Emission Control) (Before Aug. 2016 Production)</name>
    </note>
    <note id="SYS034" icon="P" file="T">
      <name>Ignition (Before Aug. 2016 Production)</name>
    </note>
    <note id="SYS038" icon="P" file="T">
      <name>Starting (1HZ) (Before Aug. 2016 Production)</name>
    </note>
  </book>
  <book id="S-DR">
    <name>Drivetrain</name>
    <note id="SYS013" icon="P" file="T">
      <name>4WD (Before Aug. 2016 Production)</name>
    </note>
    <note id="SYS015" icon="P" file="T">
      <name>Front/Rear Differential Lock (Before Aug. 2016 Production)</name>
    </note>
  </book>
  <book id="S-SS">
    <name>Suspension</name>
  </book>
  <book id="S-BK">
    <name>Brake</name>
    <note id="SYS005" icon="P" file="T">
      <name>ABS (Before Aug. 2016 Production)</name>
    </note>
  </book>
  <book id="S-AV">
    <name>Audio/Visual/Telematics</name>
    <note id="SYS001" icon="P" file="T">
      <name>Audio System (Before Aug. 2016 Production)</name>
    </note>
    <note id="SYS003" icon="P" file="T">
      <name>Auto Antenna (Before Aug. 2016 Production)</name>
    </note>
  </book>
  <book id="S-PS">
    <name>Power Source / Network</name>
    <note id="SYS120" icon="P" file="T">
      <name>Charging (1HZ) (Before Aug. 2016 Production)</name>
    </note>
    <note id="SYS124" icon="P" file="T">
      <name>DLC3 (Before Aug. 2016 Production)</name>
    </note>
    <note id="SYS126" icon="P" file="T">
      <name>Multiplex Communication System (CAN) (Before Aug. 2016 Production)</name>
    </note>
    <note id="SYS128" icon="P" file="T">
      <name>Power Source (Diesel) (Before Aug. 2016 Production)</name>
    </note>
    <note id="SYS130" icon="P" file="T">
      <name>Power Source (Gasoline) (Before Aug. 2016 Production)</name>
    </note>
    <note id="SYS134" icon="P" file="T">
      <name>Ground Point (RHD Before Aug. 2016 Production)</name>
    </note>
  </book>
  <book id="S-IN">
    <name>Vehicle Interior</name>
    <note id="SYS082" icon="P" file="T">
      <name>Air Conditioner (1HZ) (Before Aug. 2016 Production)</name>
    </note>
    <note id="SYS084" icon="P" file="T">
      <name>Cigarette Lighter (Before Aug. 2016 Production)</name>
    </note>
    <note id="SYS086" icon="P" file="T">
      <name>Clock (Before Aug. 2016 Production)</name>
    </note>
    <note id="SYS088" icon="P" file="T">
      <name>Combination Meter (Before Aug. 2016 Production)</name>
    </note>
    <note id="SYS094" icon="P" file="T">
      <name>Door Lock Control (RHD w/ Wireless Door Lock Control) (Before Aug. 2016 Production)</name>
    </note>
    <note id="SYS096" icon="P" file="T">
      <name>Door Lock Control (RHD w/o Wireless Door Lock Control) (Before Aug. 2016 Production)</name>
    </note>
    <note id="SYS098" icon="P" file="T">
      <name>Illumination (Before Aug. 2016 Production)</name>
    </note>
    <note id="SYS100" icon="P" file="T">
      <name>Immobiliser System (Before Aug. 2016 Production)</name>
    </note>
    <note id="SYS102" icon="P" file="T">
      <name>Interior Light (Before Aug. 2016 Production)</name>
    </note>
    <note id="SYS104" icon="P" file="T">
      <name>Key Reminder (Before Aug. 2016 Production)</name>
    </note>
    <note id="SYS106" icon="P" file="T">
      <name>Power Outlet (Before Aug. 2016 Production)</name>
    </note>
    <note id="SYS108" icon="P" file="T">
      <name>Rear Heater (Before Aug. 2016 Production)</name>
    </note>
    <note id="SYS110" icon="P" file="T">
      <name>Seat Belt Warning (Before Aug. 2016 Production)</name>
    </note>
    <note id="SYS112" icon="P" file="T">
      <name>SRS (Before Aug. 2016 Production)</name>
    </note>
    <note id="SYS116" icon="P" file="T">
      <name>Wireless Door Lock Control (RHD) (Before Aug. 2016 Production)</name>
    </note>
  </book>
  <book id="S-EX">
    <name>Vehicle Exterior</name>
    <note id="SYS040" icon="P" file="T">
      <name>Back-Up Light (Before Aug. 2016 Production)</name>
    </note>
    <note id="SYS042" icon="P" file="T">
      <name>Front Fog Light (Before Aug. 2016 Production)</name>
    </note>
    <note id="SYS046" icon="P" file="T">
      <name>Front Wiper and Washer (RHD 12V Battery Type) (Before Aug. 2016 Production)</name>
    </note>
    <note id="SYS048" icon="P" file="T">
      <name>Front Wiper and Washer (RHD 24V Battery Type) (Before Aug. 2016 Production)</name>
    </note>
    <note id="SYS050" icon="P" file="T">
      <name>Headlight (Before Aug. 2016 Production)</name>
    </note>
    <note id="SYS052" icon="P" file="T">
      <name>Headlight Beam Level Control (Before Aug. 2016 Production)</name>
    </note>
    <note id="SYS054" icon="P" file="T">
      <name>Horn (Before Aug. 2016 Production)</name>
    </note>
    <note id="SYS056" icon="P" file="T">
      <name>Light Reminder (Before Aug. 2016 Production)</name>
    </note>
    <note id="SYS058" icon="P" file="T">
      <name>Power Window (Before Aug. 2016 Production)</name>
    </note>
    <note id="SYS060" icon="P" file="T">
      <name>Rear Fog Light (Before Aug. 2016 Production)</name>
    </note>
    <note id="SYS062" icon="P" file="T">
      <name>Rear Window Defogger (Before Aug. 2016 Production)</name>
    </note>
    <note id="SYS064" icon="P" file="T">
      <name>Rear Wiper and Washer (Before Aug. 2016 Production)</name>
    </note>
    <note id="SYS066" icon="P" file="T">
      <name>Remote Control Mirror (Before Aug. 2016 Production)</name>
    </note>
    <note id="SYS068" icon="P" file="T">
      <name>Stop Light (Before Aug. 2016 Production)</name>
    </note>
    <note id="SYS070" icon="P" file="T">
      <name>Taillight (Before Aug. 2016 Production)</name>
    </note>
    <note id="SYS072" icon="P" file="T">
      <name>Trailer Socket (Before Aug. 2016 Production)</name>
    </note>
    <note id="SYS074" icon="P" file="T">
      <name>Turn Signal and Hazard Warning Light (12V Battery Type) (Before Aug. 2016 Production)</name>
    </note>
    <note id="SYS076" icon="P" file="T">
      <name>Turn Signal and Hazard Warning Light (24V Battery Type) (Before Aug. 2016 Production)</name>
    </note>
    <note id="SYS078" icon="P" file="T">
      <name>Winch (Before Aug. 2016 Production)</name>
    </note>
  </book>
</EwdTree>