<?xml version="1.0" encoding="utf-8"?>
<!DOCTYPE EwdTree SYSTEM "../../../../../dtd/ewdtree.dtd">
<EwdTree ver="2.1.2.9" pubno="EM25T2E" xml:lang="en">
  <text ewd="SYS039" code="A36,D8,E1,E4,F1" type="conn" figID="7">
    <name>Battery (Main)</name>
  </text>
  <text ewd="SYS039" code="D10,E3" type="conn" figID="5">
    <name>Battery (Sub)</name>
  </text>
  <text ewd="SYS039" code="E2,F2" type="conn" figID="6">
    <name>Battery (Sub)</name>
  </text>
  <text ewd="SYS039" code="A30" type="conn" figID="10">
    <name>Emission Control ECU</name>
  </text>
  <text ewd="SYS039" code="A22" type="conn" figID="9">
    <name>No. 1 Junction Connector</name>
  </text>
  <text ewd="SYS039" code="I59,I70" type="conn" figID="2">
    <name>No. 10 Junction Connector , No. 19 Junction Connector</name>
  </text>
  <text ewd="SYS039" code="C89,D5" type="conn" figID="8">
    <name>Starter Assembly</name>
  </text>
  <text ewd="SYS039" code="FUSE55" type="fuse" figID="24">
    <name>50A AM2</name>
  </text>
  <text ewd="SYS039" code="FUSE3" type="fuse" figID="25">
    <name>7.5A ST</name>
  </text>
  <text ewd="SYS039" code="AA" type="gp" figID="21">
    <name />
  </text>
  <text ewd="SYS039" code="AC" type="gp" figID="19">
    <name />
  </text>
  <text ewd="SYS039" code="FA" type="gp" figID="20">
    <name />
  </text>
  <text ewd="SYS039" code="FB" type="gp" figID="18">
    <name />
  </text>
  <text ewd="SYS039" code="FC" type="gp" figID="17">
    <name />
  </text>
  <text ewd="SYS039" code="1" type="rb" figID="4">
    <name />
  </text>
  <text ewd="SYS039" code="FUSE55" type="rb" figID="3">
    <name>50A AM2</name>
  </text>
  <text ewd="SYS039" code="FUSE3" type="rb" figID="1">
    <name>7.5A ST</name>
  </text>
  <text ewd="SYS039" code="SP3" type="sp" figID="23">
    <name />
  </text>
  <text ewd="SYS039" code="SP4" type="sp" figID="22">
    <name />
  </text>
  <text ewd="SYS039" code="AI3" type="w2w" figID="16">
    <name>Engine Room Main Wire and Cowl Wire</name>
  </text>
  <text ewd="SYS039" code="AC1" type="w2w" figID="15">
    <name>Engine Room Main Wire and Engine Wire</name>
  </text>
</EwdTree>